title,arxiv_id,related_works,search_query,papers_used
"Condorcet-Consistent Choice
Among Three Candidates",2411.19857,"In the study of voting rules, particularly those that extend the Condorcet principle, various paradoxes and challenges have been identified and addressed in the literature. A significant body of work has focused on developing voting methods that are both Condorcet consistent and resistant to certain paradoxes. Holliday and Pacuit (2020) introduced the Split Cycle method, which is notable for its independence from clones and immunity to spoilers. This method addresses the ""spoiler effects"" and ""strong no-show paradoxes,"" which are critical issues in voting theory. Their work highlights the importance of developing voting rules that maintain consistency while mitigating the impact of additional candidates or voters, a theme that resonates with the challenges addressed in our research concerning the reinforcement and no-show paradoxes in Condorcet extensions.

Another relevant contribution to the field is by Peters (2017), who explored the manipulability of Condorcet-consistent voting rules through preference reversals. Peters' work corrects and extends previous findings by demonstrating that any Condorcet-consistent rule can be manipulated when there are at least four alternatives. This insight into the strategic vulnerabilities of voting rules complements our investigation into the reinforcement and no-show paradoxes, as both lines of inquiry seek to understand and mitigate the weaknesses inherent in Condorcet extensions.

Baharav, Constantinescu, and Wattenhofer (2025) examined the complexities of Condorcet winners in the context of weighted binary voting, particularly in relation to Ostrogorski's and Anscombe's paradoxes. Their work underscores the computational challenges in identifying Condorcet winners and provides efficient algorithms for certain voting conditions. The exploration of paradoxes in weighted voting systems parallels our focus on the reinforcement and no-show paradoxes, as both studies aim to identify conditions under which these paradoxes can be avoided or mitigated.

Our research builds upon these foundational studies by specifically addressing the reinforcement and no-show paradoxes in the context of three-candidate elections. We extend the understanding of Condorcet extensions by demonstrating that certain refinements of the maximin rule are immune to these paradoxes under specific conditions. By providing axiomatic characterizations of maximin and its refinements, such as Nanson’s rule and leximin, our work contributes to the ongoing discourse on the suitability and robustness of voting rules in small candidate elections. This research not only advances theoretical insights but also offers practical implications for designing voting systems that are both fair and resistant to strategic manipulation.",Condorcet extensions voting paradoxes,"['Wesley H. Holliday, Eric Pacuit (2020). Split Cycle: A New Condorcet Consistent Voting Method Independent of Clones and Immune to Spoilers. arXiv:2004.02350v10. https://arxiv.org/abs/2004.02350v10', ""Dominik Peters (2017). Condorcet's Principle and the Preference Reversal Paradox. arXiv:1707.08760v1. https://arxiv.org/abs/1707.08760v1"", 'Carmel Baharav, Andrei Constantinescu, Roger Wattenhofer (2025). Condorcet Winners and Anscombes Paradox Under Weighted Binary Voting. arXiv:2502.14639v1. https://arxiv.org/abs/2502.14639v1']"
Topological Approach for Data Assimilation,2411.18627,"In recent years, the integration of machine learning techniques with data assimilation has gained significant attention as researchers strive to improve the accuracy and efficiency of predictions in complex dynamical systems. A common theme among several studies is the use of ensemble-based methods to address challenges associated with model imperfections and high-dimensional systems. Luo (2019) explores the use of ensemble-based kernel learning to tackle simulator imperfections in data assimilation, highlighting the advantages of functional approximation through machine learning to enhance assimilation performance [1]. Similarly, Xiao et al. (2024) introduce the Latent Dynamics EnSF (LD-EnSF) method, which synergizes latent dynamics with ensemble score filters to accelerate data assimilation in sparse observation scenarios, demonstrating robustness and efficiency in high-dimensional nonlinear problems [6]. These studies underscore the potential of ensemble-based approaches to improve data assimilation by effectively handling model errors and sparse observations.

Another significant area of research focuses on the integration of deep learning models within data assimilation frameworks to address the computational challenges posed by high-dimensional systems. Cheng et al. (2024) present TorchDA, a Python package that seamlessly combines data assimilation with deep neural networks, offering flexible algorithm selection and enhanced performance in complex systems such as the Lorenz 63 and shallow water models [2]. This approach aligns with the growing interest in leveraging deep learning to improve the representation of state transitions and observation functions in data assimilation workflows. Li et al. (2024) propose the State-Observation Augmented Diffusion (SOAD) model, a generative approach that addresses the high nonlinearity in physical and observational models, offering theoretical advantages and improved performance over existing data-driven methods [4]. These contributions highlight the versatility and effectiveness of deep learning in enhancing data assimilation processes.

The challenge of assimilating data in chaotic dynamical systems is another critical area of exploration. McCabe and Brown (2021) introduce amortized assimilation, a framework for learning to assimilate from sequences of noisy observations without requiring ground truth data, thereby improving the effectiveness of data assimilation in chaotic systems [3]. Gottwald and Reich (2020) propose a method that combines machine learning algorithms with data assimilation to achieve increased forecast capabilities, demonstrating the potential of physics-agnostic approaches to enhance probabilistic forecasting and model closure in multi-scale systems [5]. These studies emphasize the importance of developing innovative assimilation techniques that can effectively handle the inherent uncertainty and complexity of chaotic systems.

In the context of these advancements, our research introduces a novel data assimilation algorithm grounded in topological data analysis, which leverages the differentiability of functions of persistence to optimize model coefficients without relying on noise information from measurements. By focusing on minimizing topological differences between measurements and forecast predictions, our approach offers a unique perspective on data assimilation, particularly in chaotic systems like the Lorenz system. This work builds upon the themes of ensemble-based learning, deep learning integration, and innovative assimilation techniques, contributing to the ongoing efforts to enhance the accuracy and reliability of data-driven models in complex dynamical systems.",data-driven models data assimilation machine learning,"['Xiaodong Luo (2019). Ensemble-based kernel learning for a class of data assimilation problems with imperfect forward simulators. arXiv:1901.10758v1. https://arxiv.org/abs/1901.10758v1', 'Sibo Cheng, Jinyang Min, Che Liu, Rossella Arcucci (2024). TorchDA: A Python package for performing data assimilation with deep learning forward and transformation functions. arXiv:2409.00244v1. https://arxiv.org/abs/2409.00244v1', 'Michael McCabe, Jed Brown (2021). Learning to Assimilate in Chaotic Dynamical Systems. arXiv:2111.01058v1. https://arxiv.org/abs/2111.01058v1', 'Zhuoyuan Li, Bin Dong, Pingwen Zhang (2024). State-observation augmented diffusion model for nonlinear assimilation with unknown dynamics. arXiv:2407.21314v2. https://arxiv.org/abs/2407.21314v2', 'Georg A. Gottwald, Sebastian Reich (2020). Supervised learning from noisy observations: Combining machine-learning techniques with data assimilation. arXiv:2007.07383v3. https://arxiv.org/abs/2007.07383v3', 'Pengpeng Xiao, Phillip Si, Peng Chen (2024). LD-EnSF: Synergizing Latent Dynamics with Ensemble Score Filters for Fast Data Assimilation with Sparse Observations. arXiv:2411.19305v1. https://arxiv.org/abs/2411.19305v1']"
"Timely and Energy-Efficient Multi-Step Update
Processing",2411.19854v1,"The study of systems involving multiple sequential processing steps has garnered significant attention in recent years, particularly in the context of optimizing performance metrics such as Age of Information (AoI) and power consumption. A notable contribution in this domain is the work by Vaze and Nair (2019), which investigates speed scaling in tandem server settings. Their research focuses on optimizing server speeds to balance power consumption and processing efficiency, considering both worst-case and stochastic scenarios. The authors propose algorithms that maintain constant competitiveness with optimal offline solutions, highlighting the importance of speed scaling in series server setups. This work is closely related to our research, as it addresses the power-performance trade-off in series systems, a key aspect of our AoI optimization problem. [Citation: Rahul Vaze, Jayakrishnan Nair (2019). Speed Scaling with Tandem Servers. arXiv:1907.04498v1.]

Parallel server systems have also been extensively studied, with a focus on routing policies and system stability. Moyal and Perry (2019) delve into the challenges of dispatching jobs in parallel-server systems, emphasizing the impact of routing errors on system performance. Their analysis of various dispatching policies, including the join the shortest workload (JSW) and join the shortest queue (JSQ) policies, provides insights into optimizing server utilization and minimizing sojourn times. This research is pertinent to our exploration of parallel setups, where multiple processors execute computation steps simultaneously. Understanding the stability and efficiency of routing policies in parallel systems informs our approach to optimizing AoI under power constraints. [Citation: Pascal Moyal, Ohad Perry (2019). Stability of Parallel Server Systems. arXiv:1904.10331v1.]

The Age of Information in queuing systems with heterogeneous servers is another critical area of study, as demonstrated by Bhati, Pillai, and Vaze (2021). Their work presents an optimal control problem aimed at minimizing average AoI across servers with varying capabilities. By deriving exact and approximate expressions for AoI, the authors provide valuable insights into server utilization and the benefits of adding more servers to the system. This research complements our investigation by offering a framework for understanding AoI dynamics in systems with diverse processing capabilities, which is essential for formulating effective optimization strategies in both parallel and series setups. [Citation: Anhad Bhati, Sibi Raj B. Pillai, Rahul Vaze (2021). On the Age of Information of a Queuing System with Heterogeneous Servers. arXiv:2109.05752v2.]

In summary, the existing literature provides a robust foundation for our research on optimizing AoI in systems requiring multiple sequential processing steps. By integrating insights from speed scaling, routing policies, and heterogeneous server dynamics, our work aims to address the age-power trade-off in both parallel and series server setups. Our contribution lies in identifying instances of wasted power and formulating an optimization problem to determine optimal service rates under a power budget, with a focus on systems requiring two computational steps. This research not only advances the understanding of AoI performance but also offers practical solutions for enhancing efficiency in real-world applications.",Age of Information performance analysis in parallel and series server setups with power optimization,"['Rahul Vaze, Jayakrishnan Nair (2019). Speed Scaling with Tandem Servers. arXiv:1907.04498v1. https://arxiv.org/abs/1907.04498v1', 'Pascal Moyal, Ohad Perry (2019). Stability of Parallel Server Systems. arXiv:1904.10331v1. https://arxiv.org/abs/1904.10331v1', 'Anhad Bhati, Sibi Raj B. Pillai, Rahul Vaze (2021). On the Age of Information of a Queuing System with Heterogeneous Servers. arXiv:2109.05752v2. https://arxiv.org/abs/2109.05752v2']"
A GEOMETRIC INVARIANT OF LINEAR RANK-METRIC CODES,2411.19087,"The study of rank-metric codes has been a vibrant area of research due to their applicability in various domains such as network coding, distributed storage, and cryptography. A significant body of work has focused on enhancing the resilience of these codes against specific types of errors, such as crisscross errors, which affect entire rows and columns in data matrices. Liu et al. (2018) explored the concept of locality in crisscross error correction, proposing a construction of cover-metric codes with locality that achieves a Singleton-like bound on the minimum cover distance. This work highlights the importance of designing codes that can efficiently recover lost symbols using only a few local symbols, a concept that resonates with the need for robust error correction in distributed storage systems [1].

In parallel, Martínez-Peñas (2017) addressed the challenge of reducing communication overheads in secure rank-metric coding schemes. By transforming coding schemes based on linear rank-metric codes, the study achieved optimal information rates while maintaining security and error correction capabilities. This work is particularly relevant for applications involving secure linear network coding and distributed storage systems, where minimizing communication overheads is crucial [2]. Additionally, Martínez-Peñas (2022) introduced the multi-cover metric to handle multilayer crisscross errors and erasures, further expanding the theoretical framework for error correction in complex data structures [3].

The concept of locality has also been extended to the rank and subspace metrics by Kadhe et al. (2017), who constructed array codes with locality constraints in the rank metric. Their work is motivated by the need for efficient data recovery from correlated failures in distributed storage systems. By deriving a Singleton-like upper bound on the minimum rank distance, they provided a construction that achieves this bound, thereby enhancing the reliability of storage systems against crisscross errors and erasures [4]. This aligns with the broader goal of developing robust coding schemes that can withstand various error patterns in practical applications.

Furthermore, Hörmann et al. (2022) focused on the sum-rank metric, proposing an error-erasure decoder for Linearized Reed-Solomon codes. This decoder is designed to correct full errors, row erasures, and column erasures, making it particularly useful for multishot network coding. The study underscores the versatility of sum-rank metric codes in error control, which is essential for maintaining data integrity in dynamic network environments [5].

In the context of these advancements, our research introduces a novel geometric invariant for linear rank-metric codes, inspired by the Schur product used in the Hamming metric. By examining the sequence of dimensions of Schur powers of the extended Hamming code associated with a linear code, we provide a new method to differentiate Gabidulin codes from random ones. This approach not only contributes to the theoretical understanding of rank-metric codes but also offers practical insights into their geometric properties, thereby enriching the existing literature on coding theory and its applications.",rank-metric codes geometric invariants network coding distributed storage crisscross error correction post-quantum cryptography,"['Hedongliang Liu, Lukas Holzbaur, Antonia Wachter-Zeh (2018). Locality in Crisscross Error Correction. arXiv:1806.07496v2. https://arxiv.org/abs/1806.07496v2', 'Umberto Martínez-Peñas (2017). Universal secure rank-metric coding schemes with optimal communication overheads. arXiv:1705.10592v2. https://arxiv.org/abs/1705.10592v2', 'Umberto Martínez-Peñas (2022). Multilayer crisscross error and erasure correction. arXiv:2203.07238v1. https://arxiv.org/abs/2203.07238v1', 'Swanand Kadhe, Salim El Rouayheb, Iwan Duursma, Alex Sprintson (2017). Codes with Locality in the Rank and Subspace Metrics. arXiv:1707.05944v3. https://arxiv.org/abs/1707.05944v3', 'Felicitas Hörmann, Hannes Bartz, Sven Puchinger (2022). Error-Erasure Decoding of Linearized Reed-Solomon Codes in the Sum-Rank Metric. arXiv:2202.06758v2. https://arxiv.org/abs/2202.06758v2']"
